{
	"id": "PropertyName-Quality-Observed-GBOX000014",
	"type": "Device",
	"name" : "GBOX000014",
	"description": "Description du constituant qui posséde une liste de sites ou du boitier qui possède une liste de voies ou canaux",
	"address": {
		"postalCode": "06200",
		"addressLocality": "NICE",
		"addressRegion": "Alpes Maritimes",
		"addressCountry": "FR",
		"streetAddress": "Av Cyrille Besset"
	}, 
	"location": {
		"type": "Point",
		"coordinates": [
			7.1552125224843621,
			43.660530261510573
			]
	},
	"deviceClass": "C1",
	"brandName": "La marque",
	"modelName": "Modèle du device",
	"manufactureName": "Nom du fabricant",
	"serialNumber": "Numéro de serie",
	"dateInstalled":  "2017-10-31T06:00:00",
	"dateLastCalibration" : "2017-10-31T06:00:00",
	"dateCreated": "305.00.12 (Sur le nom du fichier) converti en DATETIME",
	"dateModified": "2017-10-31T06:00:00",
	"measurements": [{
		"identifier": "31408",
		"name" : "airPollution",
		"label": "Qualité d'air",
		"measurementTechnique": "NO2",
		"unitCode": "NO2",
		"unitText": "µg/m3",
		"value": ["1.800000000000000e+001"],
		"dateObserved": "2017-10-31T06:00:00",
		"height": null,
		"channelState": "db_leqg",
		"multiplier": null,
		"measureFrequency": null,
		"maxValue": null,
		"minValue": null,
		"siteGap": null ,
		"elevation": null,
		"refSeeAlso": "AirQualityStatement-GBOX000014"
	},{
		"name" : "noiseLevel",
		"label": "Bruit",
		"measurementTechnique": "db_leqg",
		"unitCode": "db_leqg",
		"unitText": "dBA",
		"value": ["7.000000000000000e+001"],
		"dateObserved": "2017-10-31T06:00:00",
		"height": null,
		"channelState": "db_leqg",
		"multiplier": null,
		"measureFrequency": null,
		"maxValue": null,
		"minValue": null,
		"siteGap": null ,
		"elevation": null,
		"refSeeAlso": "NoiseQualityStatement-GBOX000014"
	}]
}